<?xml version="1.0" encoding="UTF-8"?>
<biblioteca2  xmlns:xs="http://www.w3.org/2001/XMLSchema-instance" xs:noNamespaceSchemaLocation= "XSD_biblioteca.xsd">
    <!-- Estructura Libro -->
    <libros id="L1234" paginas_libro="245" tipo_libro="novela">
        <titulo_libro>Don Quijote </titulo_libro>
        <capitulo paginas_capitulo="23">
            <titulo_capitulo>caapitulo 1</titulo_capitulo>
            <contenido_capitulo url="www.libros.es"/>
        </capitulo>
        <capitulo paginas_capitulo="18">
            <titulo_capitulo>capitulo 2</titulo_capitulo>
            <contenido_capitulo url="www.libros.es"/>
        </capitulo>
        <indice_libro> Aqui se encuentra el indice del libro</indice_libro>
        <sinopsis_libro>Aqui se encuentra la sinopsis del libro</sinopsis_libro>
    </libros>

    <!-- Estructura Revista -->
    <revista id="R1234" tipo_revista="coches" paginas_revista="9">
        <titulo_revista>coches.net</titulo_revista>
        <numero_revista>23</numero_revista>
        <indice_revista>
            <seccion_revista paginas_seccion="5">
                <contenido_seccion_revista url="www.revistas-de-coches.es"/>
            </seccion_revista>
            <seccion_revista paginas_seccion="3">
                <contenido_seccion_revista url="www.revistas-de-coches.es"/>
            </seccion_revista>
        </indice_revista>
        <contenido_revista url="www.revistas-de-coches.es"/>
    </revista>

    <!-- Estructura Periodico -->
    <periodicos id="P1234" tipo_periodico="nacional" fecha="2021-05-15">
        <secciones_periodico tipo_seccion="deportes">
            <seccion_periodico>
                <articulos autor="cesar"></articulos>
                <articulos autor="jose luis"></articulos>
            </seccion_periodico>
        </secciones_periodico>
        <indice_periodico>Aqui se encuentra el indice del periodico</indice_periodico>
        <contenido_periodico url="www.periodico.es"></contenido_periodico>
    </periodicos>
</biblioteca2>